{"$schema":"https://json-schema.org/draft/2020-12/schema","$id":"https://example.invalid/gd-evaluation/schemas/opportunity-case-v0.1.schema.json","title":"Scenario Opportunity Case v0.1 hardened","type":"object","additionalProperties":false,"required":["contract_version","case_id","case_type","scenario_id","dimension","scenario_integrity","opportunity_status","candidate_behavior","opportunity_ids","opportunity_event_ids","candidate_message_ids","trace_excerpt","expected_outcome","expected_score_band","expected_ne_reason","explanation"],"properties":{"contract_version":{"const":"0.1"},"case_id":{"type":"string","minLength":1},"case_type":{"enum":["positive","negative","ne"]},"scenario_id":{"type":"string","minLength":1},"dimension":{"enum":["issue_framing","logical_reasoning","listening_and_response","valuable_contribution","collaboration_and_relationship","decision_and_consensus","process_and_time_management"]},"scenario_integrity":{"enum":["valid","defective"]},"opportunity_status":{"enum":["offered","not_offered","invalid"]},"candidate_behavior":{"enum":["effective","ineffective","counterproductive","not_applicable"]},"opportunity_ids":{"type":"array","minItems":1,"uniqueItems":true,"items":{"type":"string","minLength":1}},"opportunity_event_ids":{"type":"array","minItems":1,"uniqueItems":true,"items":{"type":"string","minLength":1}},"candidate_message_ids":{"type":"array","uniqueItems":true,"items":{"type":"string","minLength":1}},"trace_excerpt":{"type":"array","minItems":1,"items":{"type":"object","additionalProperties":false,"required":["id","kind","speaker_type","text"],"properties":{"id":{"type":"string","minLength":1},"kind":{"enum":["event","message"]},"speaker_type":{"enum":["user","ai","system",null]},"text":{"type":"string","minLength":1}}}},"expected_outcome":{"enum":["scoreable_positive","scoreable_low","NE"]},"expected_score_band":{"oneOf":[{"enum":["3-4","1-2"]},{"type":"null"}]},"expected_ne_reason":{"oneOf":[{"type":"null"},{"enum":["INSUFFICIENT_OPPORTUNITY","AI_QUALITY_FAILURE","TRANSCRIPT_INCOMPLETE","EVENT_ORDER_INVALID","SYSTEM_ERROR","SCENARIO_CONDITION_UNFAIR","SCENARIO_CONTRACT_FAILURE","INSUFFICIENT_EVIDENCE","JUDGE_FAILURE","OTHER_REVIEW_REQUIRED"]}]},"explanation":{"type":"string","minLength":1}},"allOf":[{"if":{"properties":{"expected_outcome":{"const":"scoreable_positive"}},"required":["expected_outcome"]},"then":{"properties":{"case_type":{"const":"positive"},"scenario_integrity":{"const":"valid"},"opportunity_status":{"const":"offered"},"candidate_behavior":{"const":"effective"},"candidate_message_ids":{"minItems":1},"expected_score_band":{"const":"3-4"},"expected_ne_reason":{"type":"null"}}}},{"if":{"properties":{"expected_outcome":{"const":"scoreable_low"}},"required":["expected_outcome"]},"then":{"properties":{"case_type":{"const":"negative"},"scenario_integrity":{"const":"valid"},"opportunity_status":{"const":"offered"},"candidate_behavior":{"enum":["ineffective","counterproductive"]},"candidate_message_ids":{"minItems":1},"expected_score_band":{"const":"1-2"},"expected_ne_reason":{"type":"null"}}}},{"if":{"properties":{"expected_outcome":{"const":"NE"}},"required":["expected_outcome"]},"then":{"properties":{"case_type":{"const":"ne"},"candidate_behavior":{"const":"not_applicable"},"candidate_message_ids":{"maxItems":0},"expected_score_band":{"type":"null"},"expected_ne_reason":{"enum":["INSUFFICIENT_OPPORTUNITY","AI_QUALITY_FAILURE","TRANSCRIPT_INCOMPLETE","EVENT_ORDER_INVALID","SYSTEM_ERROR","SCENARIO_CONDITION_UNFAIR","SCENARIO_CONTRACT_FAILURE","INSUFFICIENT_EVIDENCE","JUDGE_FAILURE","OTHER_REVIEW_REQUIRED"]}},"anyOf":[{"properties":{"scenario_integrity":{"const":"defective"}}},{"properties":{"opportunity_status":{"enum":["not_offered","invalid"]}}}]}}]}
