{"contract_version":"0.1","case_id":"opportunity-ne-c-process","case_type":"ne","scenario_id":"candidate-assessment-c-time-boxed-decision","dimension":"process_and_time_management","scenario_integrity":"defective","opportunity_status":"not_offered","candidate_behavior":"not_applicable","opportunity_ids":["C-OP-PR-01"],"opportunity_event_ids":["defect_c_01"],"candidate_message_ids":[],"trace_excerpt":[{"id":"defect_c_01","kind":"event","speaker_type":"system","text":"時間チェック前にAIが最終案を確定し、利用者へ残り時間の調整機会を与えなかった。"}],"expected_outcome":"NE","expected_score_band":null,"expected_ne_reason":"SCENARIO_CONTRACT_FAILURE","explanation":"時間管理行動を選べる場面がシステム欠陥で消失したため、未行動を低得点にしない。"}
